{
  "headline": "사상 최고 매출에도 꺾인 주가 — AI 관련 대규모 투자와 보수적 가이던스가 기술주를 압박",
  "deck": "알파벳·퀄컴·Arm·마이크로소프트는 분기 실적과 사용자·매출 지표가 개선됐음에도 AI 관련 대규모 자본지출과 단기 가이던스 우려로 시간외에서 약세를 보였습니다. 투자자들이 단기 비용·공급 변수에 더 민감하게 반응하는 흐름이 드러났습니다.",
  "report_body": "핵심적으로 주요 기술주들은 사상 최대 연간 매출 및 일부 강한 분기 지표에도 불구하고 AI 관련 대규모 자본지출과 보수적 단기 가이던스 우려를 더 크게 반영하며 시간외에서 주가 약세를 나타냈습니다. 알파벳은 2026년 자본지출을 1,750억~1,850억 달러로 제시했고, 이 수치가 시장에서 비용 확대 신호로 받아들여지며 주가가 하락했습니다. 퀄컴은 1분기 EPS·매출이 예상치를 상회했지만 2분기 가이던스가 컨센서스에 미치지 못해 시간외 약세가 컸습니다.\n\n무슨 일이 벌어졌는지에 대한 사실관계는 명확합니다. 알파벳은 연간 매출이 처음으로 4,000억 달러를 돌파했고 구글 클라우드 매출 및 제미나이의 월간 활성 사용자 증가 등 주요 지표는 양호했습니다. 퀄컴은 EPS 3.50달러, 매출 122.5억 달러로 실적을 상회했으나 가이던스(2분기 매출 102억~110억 달러, EPS 2.45~2.65달러)가 컨센서스보다 낮았습니다. Arm은 로열티와 ACV가 증가했음에도 라이선스 수익의 타이밍과 퀄컴 전망 약화로 주가 압박을 받았습니다. 스티펠과 BofA 등은 애저 공급 이슈와 핸드셋 시장 약화를 근거로 목표가·등급을 하향했습니다.\n\n이것이 중요한 이유는 투자자들이 단기적 비용 신호(대규모 AI 인프라 투자)와 가이던스·공급 관련 불확실성을 통해 기업의 단기 가치 실현 가능성을 더 중시한다는 점을 시사한다는 것입니다. 결과적으로 기업별로 강한 매출·사용자 지표가 존재하더라도 자본지출 규모, 메모리 공급 제약, 클라우드 공급 병목과 같은 요소들이 즉각적 가격 반응을 유발하면서 변동성이 커지고 있습니다. 이는 향후 분기에서 투자 회수 기대치와 공급 개선 여부가 주가 방향을 좌우할 가능성을 제시합니다.\n\n지원되는 핵심 증거로는 알파벳의 2026년 자본지출 전망(1,750억~1,850억 달러), 알파벳의 연간 매출 4,000억 달러 돌파와 제미나이 월간 활성 사용자 7억5,000만 명, 퀄컴의 1분기 실적(EPS 3.50달러·매출 122.5억 달러)과 낮아진 2분기 가이던스, Arm의 로열티·ACV 증가 등이 있습니다. 이들 수치는 시장의 해석이 실적 자체보다 투자·공급 신호에 더 큰 비중을 둔 현재의 흐름을 뒷받침합니다.\n\n마지막으로 주의할 점은 향후 시장 반응이 투자 회수 시점, 메모리 공급 개선 여부, 그리고 애저 등 클라우드 공급 병목이 일시적인지 구조적인지에 대한 진전 상황에 따라 달라질 수 있다는 점입니다. 단기적으로는 애널리스트 목표 및 등급 조정이 추가적인 변동성을 촉발할 수 있으므로 관련 지표와 공급 개선 신호를 지속 관찰할 필요가 있습니다.",
  "key_points": [
    "강한 실적에도 불구하고 알파벳·퀄컴·Arm·MSFT 주가는 AI 관련 대규모 자본지출과 보수적 가이던스 우려로 시간외에서 약세를 보였다.",
    "알파벳은 2026년 자본지출을 1,750억~1,850억 달러로 제시했으며, 연간 매출 4,000억 달러 돌파·제미나이 사용자 증가 등은 있었으나 투자 확대 신호가 부정적으로 해석됐다.",
    "퀄컴은 분기 실적이 기대를 웃돌았지만 낮은 다음 분기 가이던스와 글로벌 메모리 부족 우려가 주가에 더 크게 반영됐고, 애널리스트들의 목표·등급 하향이 단기 변동성을 키웠다."
  ],
  "risk_note": "투자 심리는 대규모 AI 자본지출의 단기 비용성·투자 회수 가시성, 메모리 공급 제약의 지속성, 그리고 클라우드(애저) 공급 병목의 일시성 여부에 민감하게 반응하고 있습니다. 이들 변수의 향방이 단기 주가 변동성과 기업별 실적 실현 시점을 결정할 주요 관찰 포인트입니다."
}
