{
  "headline": "글로벌 시장 시황 (260703) - AI·반도체 급락 속 다우 사상 최고치 경신",
  "deck": "AI·반도체 관련 투자심리가 재차 약화되며 반도체 지수와 주요 기술주가 급락한 반면, 자금은 우량주·필수소비재·의료·유틸리티 등으로 이동해 다우지수가 사상 최고치를 경신했다.",
  "report_body": "### Core Message\n...\n\n### What Happened\n...\n\n### Why It Matters\n...\n\n### Risks & Constraints\n...",
  "key_points": [
    "AI·반도체 투자심리 약화로 필라델피아 반도체 지수가 5% 하락했다.",
    "자금이 우량주·필수소비재·의료·유틸리티로 이동하며 다우가 사상 최고치를 경신했다.",
    "성장주에서 방어·우량주로의 로테이션이 뚜렷하게 나타났다."
  ],
  "risk_note": "반도체·AI 관련 변동성과 자금 로테이션 지속 여부가 단기 시장 방향의 핵심 관찰 포인트다."
}
