{
  "headline": "グローバル市場概況 (260703) - AI・半導体急落のなかダウ最高値更新",
  "deck": "AI・半導体への投資心理が再び弱まり半導体指数や主要ハイテク株が急落した一方、資金は優良株・生活必需品・医療・公益などにシフトし、ダウ平均が史上最高値を更新した。",
  "report_body": "### Core Message\n...\n\n### What Happened\n...\n\n### Why It Matters\n...\n\n### Risks & Constraints\n...",
  "key_points": [
    "AI・半導体への投資心理の弱まりでフィラデルフィア半導体指数が5%下落した。",
    "資金が優良株・生活必需品・医療・公益にシフトし、ダウ平均が史上最高値を更新した。",
    "グロース株からディフェンシブ・優良株への明確なローテーションが浮かび上がった。"
  ],
  "risk_note": "半導体・AI関連の変動性とディフェンシブへの資金シフトが続くかどうかが、短期の市場方向性を左右する主要な観察ポイントとなる。"
}
